#;patent_id;app_year;patent_year;Assignee_Org;Assignee 1;CPC;patent_title;patent_abstract;Finales Resultat
216;10402726;2018;2019;SPARKCOGNITION, INC.;SPARKCOGNITION, INC.;G06N3/088,G06N3/10,G06F3/04842,G06N3/045,G06N3/047,G06N5/01,G06N7/01,G06N20/20;Model building for simulation of one or more target features;A method includes receiving an input data set, each entry including multiple features. The method includes receiving a user input identifying a target feature of the multiple features and a target value of the target feature. The method includes determining, one or more correlated features of the multiple features. The method includes providing the input data set to multiple neural networks (including multiple VAEs) to train the multiple neural networks. The method includes generating a simulated data set based on the input data set, each entry including at least the target feature and the one or more correlated features. Values of the one or more correlated features are randomized or pseudorandomized and the target feature is fixed at the target value. The method includes providing the simulated data set to the multiple neural networks to generate output data and displaying a GUI based on the output data.;1
218;10418024;2018;2019;salesforce.com, inc.;salesforce.com, inc.;G10L13/0335,G10L13/047,G10L13/08,G10L21/003;Systems and methods of speech generation for target user given limited data;Systems and methods are provided for training an audio generation model for a first person using a first voice audio data and a first text transcript of the first voice audio data. Using a second voice audio data and a second text transcript of the second voice audio data, a plurality of pitch voice audio data for the second person may be generated with different pitches. The audio generation model may be trained for the second person using the generated plurality of pitch voice audio data with the different pitches for the second person. Output voice audio may be generated for the second person using received text and the model trained with the generated plurality of pitch voice audio data.;6
219;10418032;2016;2019;SoundHound, Inc.;SoundHound, Inc.;G06F16/3329,G10L15/22,G06F16/24522,G06F16/258,G10L15/1815,G10L15/19,G10L15/26;System and methods for a virtual assistant to manage and use context in a natural language dialog;A dialog with a conversational virtual assistant includes a sequence of user queries and systems responses. Queries are received and interpreted by a natural language understanding system. Dialog context information gathered from user queries and system responses is stored in a layered context data structure. Incomplete queries, which do not have sufficient information to result in an actionable interpretation, become actionable with use of context data. The system recognizes the need to access context data, and retrieves from context layers information required to transform the query into an executable one. The system may then act on the query and provide an appropriate response to the user. Context data buffers forget information, perhaps selectively, with the passage of time, and after a sufficient number and type of intervening queries.;3
220;10418033;2017;2019;Amazon Technologies, Inc.;Amazon Technologies, Inc.;G10L15/22,G06F3/167,G06F16/00,G06F16/635,G10L13/08,G10L15/1815,G10L15/30,G10L17/22,G10L13/00,G10L15/00,G10L2015/223;Configurable output data formats;Configurable core domains of a speech processing system are described. A core domain output data format for a given command is originally configured with default content portions. When a user indicates additional content should be output for the command, the speech processing system creates a new output data format for the core domain. The new output data format is user specific and includes both default content portions as well as user preferred content portions.;1
221;10440431;2016;2019;Amazon Technologies, Inc.;Amazon Technologies, Inc.;H04N21/44218,H04N21/23418,H04N21/252,H04N21/25891,H04N21/44226,H04N21/4532,H04N21/4666,H04N21/4667,H04N21/812,H04N21/84,H04N21/8549;Adaptive and automatic video scripting;Systems and methods are provided for facilitating automated video scripting, Video frames may be analyzed to determine scores indicative of the association between a characteristic of the video frame and an attribute of a theme associated with a particular person. Then, video frames with particular scores can be added together to automatically create a video script. Neural networks can be used to determine the scores. The neural network may also be trained using training data, and updated based on the interaction of a person to a video script.;3
222;10445356;2017;2019;Pulselight Holdings, Inc.;Pulselight Holdings, Inc.;G06F16/345,G06F16/334,G06F40/30,G06F40/58,G06N3/044,G06N3/08,G06N3/084,G06N3/045,G06N7/01;Method and system for analyzing entities;A recurrent neural network (RNN) method implemented on a computer system is used to produce summaries of unstructured text generated by multiple networks of individuals interacting over time by encoding the unstructured text into intermediate representations and decoding the intermediate representations into summaries of each network. Parameter data for the RNN is obtained by using multiple different versions of the same source texts to train the computer system. The method and computer system can be used to identify which of the networks match a query by determining which network generates the query with low or lowest cost.;2
223;10446126;2018;2019;;;G10H1/0025,G10H1/0091,G10H1/20,G10H7/02,G10H2210/105,G10H2210/115,G10H2210/151,G10H2240/131,G10H2250/541;System for generation of musical audio composition;A musical audio composition is generated based on a content library. The library is a collection of sequences and instruments. Sequences are partial musical compositions, while instruments are groups of audio samples. Instruments are made of audio data and musical data describing the events recorded in the audio. The process begins by reading the library. A new chain is created. A succession of sequences are selected to create a series of segments in the chain. The events in the selected sequences determine the selection of instruments. Algorithms determine the final arrangements and exact modulations of source audio to target outputs. The source audio are modulated, mixed and output as a stream of audio data. Finally the selections and events of the finished segment are output as metadata. An unlimited number of segments can be fabricated in series, each building and evolving from the preceding segments in the chain.;2
224;10446147;2017;2019;Amazon Technologies, Inc.;Amazon Technologies, Inc.;G06F40/205,G10L15/22,G06F3/167,G06F40/30,G10L15/063,G10L15/26,G10L2015/223;Contextual voice user interface;Techniques for providing a contextual voice user interface that enables a user to query a speech processing system with respect to the decisions made to answer the user's command are described. The speech processing system may store speech processing pipeline data used to process a command. At some point after the system outputs content deemed responsive to the command, a user may speak an utterance corresponding to an inquiry with respect to the processing performed to respond to the command. For example, the user may state “why did you tell me that?” In response thereto, the speech processing system may determine the stored speech processing pipeline data used to respond to the command, and may generate output audio data that describes the data and computing decisions involved in determining the content deemed responsive to the command.;2
225;10453434;2018;2019;;;G06F16/634,G10H1/0025,G06F3/0482,G06F7/582,G06F16/632,G06N7/00,G06N7/01,G10L13/06,G10L25/03,G10L25/18,G10L25/24,G10L25/54,G06N3/088,G06N3/126,G10H2210/041,G10H2240/081,G10H2240/141,G10H2240/145,G10H2250/235,G10H2250/261;System for synthesizing sounds from prototypes;"A system is presented for generation of output sounds having psychoacoustic qualities comparable to input sound or sounds. Short term and intermediate term features are computed for each input sound, sound components are clustered, filtered, and scored; and a prediction learning system is trained on the probabilities of classes of regions over time. A decoder can make use of this information to generate outputs that sound similar to, but not the same as, the input sound or sounds. The method and apparatus can be operated with no special training.";2
226;10453476;2017;2019;OBEN, INC.;OBEN, INC.;G10L25/30,G06N3/04,G06N3/045,G06N3/084,G10L21/007,G10L21/013,G10L25/24,G10L2021/0135;Split-model architecture for DNN-based small corpus voice conversion;A voice conversion system suitable for encoding small and large corpuses is disclosed. The voice conversion system comprises hardware including a neural network for generating estimated target speech data based on source speech data. The neural network includes an input layer, an output layer, and a novel split-model hidden layer. The input layer comprises a first portion and a second portion. The output layer comprises a third portion and a fourth portion. The hidden layer comprises a first subnet and a second subnet, wherein the first subnet is directly connected to the first portion of the input layer and the third portion of the output layer, and wherein the second subnet is directly connected to the second portion of the input layer and the fourth portion of the output layer. The first subnet and second subnet operate in parallel, and link to different but overlapping nodes of the input layer.;1
227;10467274;2017;2019;Snap Inc.;Snap Inc.;G06N3/006,G06F16/3344,G06F16/338,G06F18/256,G06N3/044,G06N3/045,G06N3/084,G06V10/811,G06V10/82,G06V10/94,G06N5/02,G06N5/022;Deep reinforcement learning-based captioning with embedding reward;An image captioning system and method is provided for generating a caption for an image. The image captioning system utilizes a policy network and a value network to generate the caption. The policy network serves as a local guidance and the value network serves as a global and lookahead guidance.;4
228;10467347;2016;2019;ARRIA DATA2TEXT LIMITED;ARRIA DATA2TEXT LIMITED;G06F40/157,G06F40/56,G06F16/3344,G06F16/93,G06F40/117,G06F40/211,G06F40/232,G06F40/253,G06F40/268,G06F40/284;Method and apparatus for natural language document orchestrator;Methods, apparatuses, and computer program products are described herein that are configured to be embodied as a natural language document orchestrator. In some example embodiments, a method is provided that comprises generating natural language text. The method of this embodiment may also include executing document orchestration requests from a scripted input language file.;2
229;10468014;2019;2019;Capital One Services, LLC;Capital One Services, LLC;G10L13/033,G10L25/51,G06F3/167,G10L15/07,G10L15/22,G10L17/26,H03G3/32;Updating a speech generation setting based on user speech;A device causes a communication session to be established between the device and a user device to allow the device and the user device to communicate speech, and receives user speech from the user device. The device processes the user speech using a natural language processing technique to determine a plurality of characteristics of the user speech, and updates a speech generation setting of a plurality of speech generation settings based on the plurality of characteristics of the user speech. The device generates, after updating the speech generation setting, device speech using a text-to-speech technique based on the speech generation setting, and sends the device speech to the user device.;1
230;10468019;2017;2019;Kadho, Inc.;Kadho, Inc.;G10L15/187,G10L15/02,G10L15/142,G10L15/16,G10L15/22,G10L15/30,G10L15/06,G10L25/51,G10L2015/025;System and method for automatic speech recognition using selection of speech models based on input characteristics;A method and system method for automatic speech recognition using selection of speech models based on input characteristics is disclosed herein. The method includes obtaining speech data from a speaker utilizing a microphone or an audio upload. The system and method select the best speech recognition model to automatically decode the input speech and continuously update models by updating/creating models in a database based on users speech abilities.;0
231;10469665;2016;2019;Amazon Technologies, Inc.;Amazon Technologies, Inc.;H04M3/5191,G06F3/0481,G06F40/205,G06F40/35,G06N3/044,G06N3/08,G06Q10/06,H04L51/02,H04L51/046,H04L51/216,H04L67/141,H04L67/306,H04L67/535,H04M3/42382,H04M3/5233,H04M3/527,G06N3/006;Workflow based communications routing;Disclosed are various embodiments for routing communications to service agents based on a workflow. A computing device identifies a user intent object corresponding to a user interaction with the computing device. The computing device then identifies a workflow corresponding to the user intent object. Later, the computing device identifies a service agent capable of completing the workflow. Then, the computing device routes a user to the service agent.;0
232;10475438;2017;2019;Amazon Technologies, Inc.;Amazon Technologies, Inc.;G10L13/10,G10L13/033,G10L13/047,G10L2013/105;Contextual text-to-speech processing;A text-to-speech (TTS) system that is capable of considering characteristics of various portions of text data in order to create continuity between segments of synthesized speech. The system can analyze text portions of a work and create feature vectors including data corresponding to characteristics of the individual portions and/or the overall work. A TTS processing component can then consider feature vector(s) from other portions when performing TTS processing on text of a first portion, thus giving the TTS component some intelligence regarding other portions of the work, which can then result in more continuity between synthesized speech segments.;1
233;10481579;2019;2019;Nanotronics Imaging, Inc.;Nanotronics Imaging, Inc.;G05B19/406,G05B19/19,G05B19/4183,G06Q10/0633,G06Q10/0639,G05B19/41805,G05B2219/31027,G05B2219/31046,G05B2219/40556,G06N3/044,G06N3/045,G06N7/01,G06N20/10,G06N20/20,G06Q50/04,Y02P90/02;Dynamic training for assembly lines;Aspects of the disclosed technology provide an Artificial Intelligence Process Control (AIPC) for automatically detecting errors in a manufacturing workflow of an assembly line process, and performing error mitigation through the update of instructions or guidance given to assembly operators at various stations. In some implementations, the disclosed technology utilizes one or more machine-learning models to perform error detection and/or propagate instructions/assembly modifications necessary to rectify detected errors or to improve the product of manufacture.;1
234;10484542;2018;2019;;;H04M3/5183,G06F40/279,G06F40/35,H04L51/02,H04M3/42382,H04M2203/2061;System and method for hybridized chat automation;"In a system for managing blended agent and automated chat in a contact center setting, the system includes: a chat orchestration server invoking natural language processing on a received communication, selecting a standardized text communication responsive to the natural-language-processed communication, and transmitting the standardized text communication to an agent device; and a knowledge management server for determining confidence values and populating ranked lists of responsive standardized text communications.";1
235;10489393;2016;2019;Amazon Technologies, Inc.;Amazon Technologies, Inc.;G06F16/243,G10L15/22,G06F16/24522,G06F16/2455,G06F16/3329,G06F16/9038,G06F40/205,G06F40/211,G06F40/30,G10L15/26,G10L13/00;Quasi-semantic question answering;A voice-controlled question answering system that uses both a knowledge base and a detailed index of other sources that may be accessible over the Internet. The knowledge base is used to answer questions of more general interest whose answers are contained in the knowledge base. The index is used to answer more complex questions that are not answerable using the knowledge base. Web and other sources are analyzed to create the index, where text segments are indexed along with data describing the text segments in a quasi-semantic way. Quasi-semantic features are extracted from incoming spoken questions and used, along with machine learning trained models, to identify an indexed text segment that includes the answer to the question. The text segment may then be rearranged or simply passed to a speech synthesizer so the answer may be spoken aloud to a user.;3
236;10489682;2017;2019;Automation Anywhere, Inc.;Automation Anywhere, Inc.;G06N3/084,G06F18/214,G06F18/41,G06N3/04,G06N3/045,G06N3/08,G06V30/162,G06V30/19133,G06V30/19147,G06V30/224,G06V30/414,G06V30/416,G06N3/044,G06V30/10;Optical character recognition employing deep learning with machine generated training data;An optical character recognition system employs a deep learning system that is trained to process a plurality of images within a particular domain to identify images representing text within each image and to convert the images representing text to textually encoded data. The deep learning system is trained with training data generated from a corpus of real-life text segments that are generated by a plurality of OCR modules. Each of the OCR modules produces a real-life image/text tuple, and at least some of the OCR modules produce a confidence value corresponding to each real-life image/text tuple. Each OCR module is characterized by a conversion accuracy substantially below a desired accuracy for an identified domain. Synthetically generated text segments are produced by programmatically converting text strings to a corresponding image where each text string and corresponding image form a synthetic image/text tuple.;5
237;10490195;2017;2019;Amazon Technologies, Inc.;Amazon Technologies, Inc.;G10L17/04,G06F3/167,G10L13/00,G10L15/1815,G10L15/22,G10L17/22;Using system command utterances to generate a speaker profile;"Systems, methods, and devices related to establishing voice identity profiles for use with voice-controlled devices are provided. The embodiments disclosed enhance user experience by customizing the enrollment process to utilize voice recognition for each user based on historical information which can be used in the selection process of phrases a user speaks during enrollment of a voice recognition function or skill. The selection process can utilize phrases that have already been spoken to the electronic device; it can utilize phrases, contacts, or other personalized information it can obtain from the user account of the person enrolling; it can use any of the information just described to select specific words to enhance the probably of achieving higher phonetic matches based on words the individual user is more likely to speak to the device.";1
238;10496754;2017;2019;Elemental Cognition Inc.;Elemental Cognition Inc.;G06F40/30,G06F16/22,G06F16/3329,G06F16/3331,G06F40/211,G06F40/35,G06F40/40,G06N3/006,G06N5/02,G06N5/027,G06N5/04,G06N7/01,G06N20/00,G10L15/26;Architecture and processes for computer learning and understanding;An architecture and processes enable computer learning and developing an understanding of arbitrary natural language text through collaboration with humans in the context of joint problem solving. The architecture ingests the text and then syntactically and semantically processes the text to infer an initial understanding of the text. The initial understanding is captured in a story model of semantic and frame structures. The story model is then tested through computer generated questions that are posed to humans through interactive dialog sessions. The knowledge gleaned from the humans is used to update the story model as well as the computing system's current world model of understanding. The process is repeated for multiple stories over time, enabling the computing system to grow in knowledge and thereby understand stories of increasingly higher reading comprehension levels.;1
239;10496884;2017;2019;DEEPRADIOLOGY, INC.;DEEPRADIOLOGY, INC.;G06T7/0012,G06N3/045,G06N3/084,G06V10/82,G06V20/20,G06V30/1916,G06V30/19173,G06V30/413,G06T2207/20081,G06T2207/20084,G06T2207/30176,G06V2201/03;Transformation of textbook information;Methods and systems for transforming image data and training or testing neural networks. Images from textbooks can contain valuable related text. Transforming the related text into discrete determinate labels can be performed using natural language processing. Once transformed, the images and the labels can be advantageously used together to train neural networks.;1
240;10503804;2019;2019;Capital One Services, LLC;Capital One Services, LLC;G06F16/9577,G06F8/22,G06F8/38,G06F8/77,G06F11/3438,G06F11/3672,G06F11/3684,G06F11/3692,G06F16/9535,G06F16/9536,G06F16/958,G06N3/126,G06F11/3419;System for automating the creation and evaluation of website variations to improve user engagement;Described is a system (and method) for automating the process of generating variations of a website that may be continually evaluated to improve a user interaction flow. The process may be based on a genetic algorithm that creates improving generations of websites. For example, the system may automate the creation of different layouts for a website and evaluate the effectiveness of each layout based on a particular user interaction goal. The most effective (e.g., top performing) layouts may be determined and then “bred” as part of an iterative improvement process.;0
241;10504268;2018;2019;Educational Testing Service;Educational Testing Service;G06V10/82,G06F3/011,G06T11/60,G06T13/40,G06V10/764,G06V10/772,G06V40/174,G06T2200/24,H04N7/157;Systems and methods for generating facial expressions in a user interface;Example systems and methods are disclosed for generating facial expressions in an avatar-based user interface for a computing device. An example system may include a digital camera, a display device and a user interface application. The digital camera may be configured to capture image data of a user over time. The user interface application may be stored on a non-transitory computer-readable medium and executable by a processor, and may include: an expression feature extractor configured to process the image data of the user to generate a plurality of facial expression descriptor vectors, a sketch generation module configured to use a first conditional deep convolutional generative adversarial network (DC-GAN) model to generate an expressive facial sketch image of an avatar based on the plurality of facial expression descriptor vectors, and an image generation module configured to use a second conditional DC-GAN model to generate a facial expression image from the expressive facial sketch image. The display device may be configured to display the facial expression image as a user interface avatar.;3
242;10504504;2018;2019;VocaliD, INC.;VocaliD, INC.;G10L15/063,G10L25/51,G10L15/22,G10L25/18,G10L25/24,G10L25/27,G10L25/69;Image-based approaches to classifying audio data;Image-based machine learning approaches are used to classify audio data, such as speech data as authentic or otherwise. For example, audio data can be obtained and a visual representation of the audio data can be generated. The visual representation can include, for example, an image such as a spectrogram or other visual or electronic representation of the audio data. Before processing the image, the audio data and/or image may undergo various preprocessing techniques. Thereafter, the image representation of the audio data can be analyzed using a trained model to classify the audio data as authentic or otherwise.;1
243;10510358;2017;2019;Amazon Technologies, Inc.;Amazon Technologies, Inc.;G10L13/02,G10L13/047,G10L13/08,G10L25/30;Resolution enhancement of speech signals for speech synthesis;An approach to speech synthesis uses two phases in which a relatively low quality waveform is computed, and that waveform is passed through an enhancement phase which generates the waveform that is ultimately used to produce the acoustic signal provided to the user. For example, the first phase and the second phase are each implemented using a separate artificial neural network. The two phases may be computationally preferable to using a direct approach to yield a synthesized waveform of comparable quality.;0
244;10511908;2019;2019;ADOBE INC.;ADOBE INC.;H04R3/04,G06N3/045,G06N3/047,G06N3/08,G06N20/00,G10L21/0224,G10L21/0232,G10L25/30;Audio denoising and normalization using image transforming neural network;Techniques are disclosed for reducing noise from an audio signal. A methodology implementing the techniques according to an embodiment includes generating a 2-dimensional (2D) spectrogram of a received audio signal and applying the 2D spectrogram to an image transformation neural network that is trained to transform the 2D spectrogram to generate an output spectrogram representing a denoised version of the received audio signal. The method further includes converting the output spectrogram to the time domain to generate the denoised audio signal. The neural network is trained on spectrogram images of clean and corrupted versions of training audio signals such that the trained neural network converts a spectrogram image of a corrupted audio signal into a spectrogram image more closely resembling a spectrogram of the associated clean audio signal. The denoising may also include removal of other degradation effects, including reverberation, unwanted voices, and unwanted music, from an audio signal.;1
