#;patent_id;app_year;patent_year;Assignee_Org;Assignee 1;CPC;patent_title;patent_abstract;Finales Resultat
423;11094134;2020;2021;Booz Allen Hamilton Inc.;Booz Allen Hamilton Inc.;G06T15/20,G06T19/006,G06T11/00,G06T15/503,G06T15/506;System and method for generating synthetic data;"Exemplary systems and methods are directed to generating synthetic data for computer vision. A processing device generates a synthetic three-dimensional (3D) image of an object. A background image is selected, and a composite image is generated by combining the 3D image of the object and the background image. The processing device simulates: reflection or emission of at least one type of radiant energy from the surface of the object and/or the background according to a set of parameters associated with at least one of the object and the background image; and a reflectance or emittance measurement of the at least one type of radiant energy from the surface of the object by a sensor device configured for detecting the at least one type of radiant energy. The processing device generates a plurality of two-dimensional (2D) simulated images of different perspectives of the object based on simulation data.";3
424;11095579;2020;2021;YSEOP SA;YSEOP SA;H04L51/02,G06F40/40,H04L51/216,G06F40/35;Chatbot with progressive summary generation;Methods and apparatus for summarizing a chatbot interaction with a user are provided. The method comprises using at least one computer hardware processor to perform generating an initial summary based, at least in part, on user data, receiving first input from the user during the chatbot interaction, processing the first input with a natural language processing engine, updating the initial summary based, at least in part, on an output of the processing by the natural language processing engine to generate an updated summary, wherein the updating is performed prior to completion of the chatbot interaction, and outputting a final summary of the chatbot interaction, wherein the final summary of the chatbot interaction is based, at least in part, on the updated summary.;2
425;11106903;2018;2021;Amazon Technologies, Inc.;Amazon Technologies, Inc.;G06V20/64,G06F18/2132,G06F18/217,G06V10/143,G06V10/56,G06V10/82,G06V40/103,G06V10/58;Object detection in image data;Techniques are generally described for object detection in image data. A first frame of image data associated with a first domain is received by a detector executing on at least one computing device. The detector generates a first feature data in the first domain. The first feature data is transformed from the first domain into a second feature data in a second domain. The detector may be effective to detect objects in the second domain. A location of an object in the first frame of image data is determined based at least in part on the second feature data.;0
426;11107228;2020;2021;Ford Global Technologies, LLC;Ford Global Technologies, LLC;G06T7/50,G06T7/10,G06T11/00,G06V10/774,G06V10/82,G06T2207/10024,G06T2207/10028,G06T2207/20084,G06T2207/30244;Realistic image perspective transformation using neural networks;"The present disclosure discloses a system and a method. In example implementations, the system and the method can include receiving an image having a first perspective; generating, via a deep neural network, a depth map corresponding to the image having the first perspective; generating, via the deep neural network, a point cloud representation based on the depth map; projecting the point cloud representation onto a point cloud representation corresponding to an image having a second perspective; generating a depth map corresponding to the image having the second perspective; and generating a synthetic image having the second perspective based on the depth map corresponding to the image having the second perspective and a semantic segmentation map corresponding to the image having the first perspective, wherein the second perspective is different from the first perspective.";3
427;11107557;2018;2021;;;G16C20/30,G16C20/80,G16C10/00;Force field based molecular structure and conformer generation;Systems and methods for molecular structure generation and conformer elaboration, in which natural physical molecular movements can be combined with a molecular force field that constrains those movements, to rapidly produce conformational variants with relatively low energy. Construction and energy minimization of initial and subsequent 3D molecular models using force field parameters, are combined with alteration of the molecular model using biophysical transformations, to generate one or more conformations thereof. The biophysical transformations each include natural physical movements of parts of the molecule, such as rotation of atoms or bonds about a selected axis in the 3D molecular model. The selected axis can define ring components, selected bonds within a macrocyclic ring, selected bonds joining substituents or other portions of the molecule, or axes or lines defining one or more geometric features of the molecular model. Once altered using biophysical transformations, the 3D molecular model can also have energy minimization performed with respect to a molecular force field model. A subset of the generated conformers can be collected, compressed from time to time, and selected for output.;0
428;11107591;2020;2021;ROM Technologies, Inc.;ROM Technologies, Inc.;G06F40/58,G16H80/00,G06F40/205,G06N3/02,G06N20/00,G16H10/60,G16H20/10,G16H20/30,G16H20/60,G16H20/70,G16H40/67,G16H50/20,G06N3/08;Method and system for describing and recommending optimal treatment plans in adaptive telemedical or other contexts;A method is disclosed for providing, by an artificial intelligence engine, an optimal treatment plan to use with a treatment apparatus. The method includes receiving, from a data source, clinical information pertaining to results of using the treatment apparatus to perform particular treatment plans for people having certain characteristics. The clinical information has a first data format. The method also includes translating a portion of the clinical information from the first data format to a medical description language used by the artificial intelligence engine, determining, based on the portion of the clinical information described by the medical description language and a plurality of characteristics pertaining to a patient, the optimal treatment plan for the patient to follow using the treatment apparatus to achieve a desired result, and providing the optimal treatment plan to be presented on a computing device of a medical professional.;2
429;11109099;2020;2021;Disney Enterprises, Inc.;Disney Enterprises, Inc.;H04N21/44218,H04N21/458,H04N21/4665,H04N21/6373,H04N21/64792;Techniques for streaming a media title based on user interactions with an internet of things device;In various embodiments, an interactive streaming application plays back a media title via a client device. In operation, the interactive streaming application causes the client device to playback a first chunk of the media title. While the client device plays back the first chunk, the interactive streaming application determines a movement of an internet of things (“IoT”) device that is controlled by the user. The interactive streaming application performs reinforcement-learning operation(s) based on the first chunk and the movement to determine a second chunk of the media title to playback. The interactive streaming application then causes the client device to playback the second chunk of the media title. Advantageously, the interactive streaming application can automatically personalize the playback of the media title for the user based, at least in part, on movements of the IoT device.;0
430;11113578;2020;2021;ADOBE INC.;ADOBE INC.;G06V10/82,G06F18/213,G06F18/214,G06F18/2411,G06N3/006,G06N3/045,G06N3/08,G06V10/7715,G06N3/044;Learned model-based image rendering;A non-photorealistic image rendering system and related techniques are described herein that train and implement machine learning models to reproduce digital images in accordance with various painting styles and constraints. The image rendering system can include a machine learning system that utilizes actor-critic based reinforcement learning techniques to train painting agents (e.g., models that include one or more neural networks) how to transform images into various artistic styles with minimal loss between the original images and the transformed images. The image rendering system can generate constrained painting agents, which correspond to painting agents that are further trained to reproduce images in accordance with one or more constraints. The constraints may include limitations of the color, width, size, and/or position of brushstrokes within reproduced images. These constrained painting agents may provide users with robust, flexible, and customizable non-photorealistic painting systems.;2
431;11113771;2015;2021;INTUIT INC.;INTUIT INC.;G06Q40/123,G06F16/2246,G06F16/9024;Systems, methods and articles for generating sub-graphs of a tax calculation graph of a tax preparation system;Systems, methods and articles of manufacture for generating a sub-graph of a tax calculation graph usable by a tax calculation engine to perform tax calculation operations. The system includes a computing device, a data store in communication with the computing device and a tax preparation software application executable by the computing device. The system comprises a tax calculation graph and a sub-graph engine which executes on the computing device. The sub-graph engine is configured to generate a sub-graph of the tax calculation graph based upon a target node and one or more user enterable nodes selected from the nodes of the tax calculation graph. The sub-graph engine analyzes the tax calculation graph in view of the target node and user enterable nodes and generates a sub-graph which excludes all nodes which are not necessary to calculate the target node.;1
432;11113862;2020;2021;Sony Interactive Entertainment Inc.;Sony Interactive Entertainment Inc.;G06T13/80,A63F13/26,A63F13/30,A63F13/355,A63F13/55,A63F13/58,G06T13/40,A63F2300/5553,A63F2300/6607;Simulating motion of computer simulation characters to account for simulated injuries to the characters using current motion model;An injury to a computer game character is simulated by changing the length or weight of an injured body part, or by adding additional links to the skeleton of the character to make the character harder to control. The facial expression of the character also can change. A generative adversarial network (GAN) may be used to learn motion under circumstances of injury to better mimic motion of an injured human as may be derived from, e.g., motion capture (MOCAP) video.;0
433;11115530;2020;2021;Bank of America Corporation;Bank of America Corporation;H04M3/4936,H04M3/5166,G06F40/40,H04M3/42382,H04M3/4933,G06F40/30,H04M3/58;Integration of human agent and automated tools for interactive voice response (IVR) systems;When a caller initiates a conversation with an interactive voice response (“IVR”) system, the caller may be transferred to a live agent. Apparatus and methods are provided for integrating automated tools and artificial intelligence (“AI”) into the interaction with the IVR system. The automated tools and AI may track the conversation to decipher when to transfer the caller to the agent. The agent may determine which machine generated responses are appropriate for the caller. AI may be leveraged to suggest responses for both caller and agent while they are interacting with each other. The agent may transfer back the caller to the IVR system along with the appropriate machine generated response to maintain efficiency and shorten time of human agent interaction.;1
434;11120812;2020;2021;CRESTA INTELLIGENCE INC.;CRESTA INTELLIGENCE INC.;G10L21/007,G10L21/013,G06N20/00,G06Q30/01,G10L15/063,G10L15/22,G10L25/51,H04M3/5133,G06N3/084,G06N5/047,G10L25/48,G10L25/63,G10L25/90,G10L2015/228,G10L2021/0135,H04M2203/2061;Application of machine learning techniques to select voice transformations;Techniques for monitoring a conversation in real-time to detect attributes of a conversation, identifying a desired outcome of the conversation, and identifying voice modulations that may be applied to the agent's voice to help accomplish the desired outcome are disclosed. The system may identify voice modulations by comparing a current conversation to one or more prior conversations having desired outcomes similar to that of the current conversation. A trained machine learning model may select and apply voice modulations associated with accomplishing a desired outcome.;0
435;11120839;2019;2021;Amazon Technologies, Inc.;Amazon Technologies, Inc.;G11B27/102,G06F18/23,G06V10/762,G06V20/49,G06V40/161,G10L15/26,G10L25/57,G11B27/28,G11B27/32,G10L25/78,G10L25/81;Segmenting and classifying video content using conversation;Disclosed are various embodiments for segmenting and classifying video content using conversation. In one embodiment, a plurality of segments of a video content item are generated by analyzing audio accompanying the video content item. A subset of the plurality of segments that correspond to conversation segments are selected. Individual segments of the subset of the plurality of segments are processed to determine whether a classification applies to the individual segments. A list of segments of the video content item to which the classification applies is generated.;0
436;11121987;2020;2021;Octane AI, Inc.;Octane AI, Inc.;H04L51/02,H04L51/216;Conversational support for user journey;Interacting with a user of an electronic device includes presenting information to the user on a screen of the electronic device, a first chatbot that corresponds to the information presented to the user engaging in a conversation with the user based on an agenda that is related to the information presented to the user, the first chatbot recommending an action to the user based at least in part on the conversation and on the agenda, and updating the agenda and presenting new information on the electronic device in response to an action performed by the user. The agenda may be customized for the user based on available information about the user. Information about the user may include information about user behavior, previous actions performed by the user, previous user conversations with chatbots, and/or user personal data. The first chatbot may answer questions by the user about the information.;1
437;11122165;2020;2021;Verizon Patent and Licensing Inc.;Verizon Patent and Licensing Inc.;H04M3/5191,H04L51/02,H04L51/216,H04M3/5133,H04M3/5175,H04M7/0045,H04M3/2281,H04M2201/14,H04M2203/403,H04M2203/551;Systems and methods for customer service agent-guided chat session digital assistant;"A method, device, and computer-readable medium provide for receiving, via a chatbot access channel, a chat message from a user device associated with a customer chat session; determining that the chat message includes a customer intent that corresponds to a chat flow for the customer chat session; generating one or more suggested response messages based on the chat message, wherein at least one of the one or more suggested response messages includes a previously stored chat message response corresponding to the customer intent and approved by a service agent; presenting, via a display, a transcript of a messaging sequence for the customer chat session concurrently with a user interface that enables the service agent to perform an action with respect to the one or more suggested response messages; and sending, via the chatbot access channel, a selected one of the one or more suggested response messages to the user device.";2
438;11122238;2018;2021;Twitter, Inc.;Twitter, Inc.;G06T3/4053,H04N7/0137,G06N3/045,G06N3/047,G06N3/08,G06N3/088,G06T3/4007,H04N7/0127;Frame interpolation with multi-scale deep loss functions and generative adversarial networks;A method includes selecting two or more frames from a plurality of frames of a video, downscaling the two or more frames, estimating a flow data based on an optical flow associated with the downscaled two or more frames, upscaling the flow data, generating a refined flow data based on the upscaled flow data and the downscaled two or more frames, upscaling the refined flow data, and synthesizing an image based on the upscaled refined flow data and the two or more frames.;0
439;11126826;2020;2021;shallow.AI Inc.;shallow.AI Inc.;G06V40/165,G06F18/21,G06N3/045,G06N3/047,G06N3/08,G06V10/454,G06V10/764,G06V10/82,G06V40/171,G06V40/174,G06N5/022;Machine learning system and method for recognizing facial images;A machine learning system extracts features from images. A system and method predicts appearance type, attractiveness, gender, or ethnicity from a facial image. In a machine learning approach, predictor training is performed by using known data sets containing the classification information for a given facial image into the desired categories. When a new image is presented, the system applies this info to the new image. The training can be performed continuously while the system is being presented with new images and corrective results in a feedback loop. In another machine learning approach, a generative adversarial network is used to predict the desired categories based on the given facial image.;0
440;11127225;2020;2021;Microsoft Technology Licensing, LLC;Microsoft Technology Licensing, LLC;G06T17/00,G06T19/20,G06N3/045,G06N3/088,G06T15/04,G06T19/006,G06T2200/04,G06T2219/2008;Fitting 3D models of composite objects;"A method of fitting a three dimensional (3D) model to input data is described. Input data comprises a 3D scan and associated appearance information. The 3D scan depicts a composite object having elements from at least two classes. A texture model is available which, given an input vector, computes, for each of the classes, a texture and a mask. A joint optimization is computed to find values of the input vector and values of parameters of the 3D model, where the optimization enforces that the 3D model, instantiated by the values of the parameters, gives a simulated texture which agrees with the input data in a region specified by the mask associated with the 3D model; such that the 3D model is fitted to the input data.";0
441;11127488;2021;2021;Accenture Global Solutions Limited;Accenture Global Solutions Limited;G16C20/50,G06N20/00,G16C20/70,G16H20/10,G16H70/40;Machine learning systems for automated pharmaceutical molecule screening and scoring;Aspects of the present disclosure provide systems, methods, and computer-readable storage media that leverage artificial intelligence and machine learning to screen candidate pharmaceutical molecules or compounds for pharmaceutical uses (e.g., treating diseases or conditions). The screening may be based on structural similarity between the candidate pharmaceutical molecules and various pharmaceutical targets (e.g., proteins, nucleic acids, etc.). In aspects, one or more machine learning (ML) models may be trained to assign a candidate pharmaceutical molecule to one of multiple clusters based on chemical/physical properties of the candidate pharmaceutical molecule and chemical/physical properties of pharmaceutical targets associated with the clusters. The pharmaceutical targets associated with the cluster may be scored based on comparisons between the candidate pharmaceutical molecule and the pharmaceutical target, and a subset of the pharmaceutical targets may be identified based on the scores. In some implementations, the subset may be ranked using conjoint analysis and machine learning.;0
442;11132598;2021;2021;NEURAVILLE, LLC;NEURAVILLE, LLC;G06N3/045,B25J9/163,G06N3/049,G06N3/08,G06N3/082,G06N3/088;System and method for humanoid robot control and cognitive self-improvement without programming;"A method for automatically generating a neural network architecture includes: loading a first computer-readable representation of a first neural network architecture including first genes representing parameters of the first neural network architecture; generating a first neural network including neurons in accordance with the first genes; deploying the first neural network in a robotic controller; training the first neural network by supplying inputs to an input processing unit connected to the first neural network and receiving outputs from an output processing unit connected to the first neural network, the training including updating synaptic weights of connections between the neurons based on responses to the inputs supplied to the input processing unit; evaluating a performance of the first neural network architecture; and generating, by the computer system, an updated computer-readable representation of an updated neural network architecture based on the evaluation of the performance the first neural network.";0
443;11138249;2018;2021;REALPAGE, INC.;REALPAGE, INC.;G06F16/3347,G06F16/90332,G06F16/35,G06F16/951,G06F16/9537,G06F40/30,G06N5/01,G06N5/02,G06N5/025,G06N20/00;Systems and methods for the creation, update and use of concept networks to select destinations in artificial intelligence systems;Systems and methods for concept based searching or recommendation are disclosed. More particularly, embodiments of a concept based approach to the search and analysis of data, including the creation, update or use of concept networks in searching and analyzing data are disclosed, including embodiments of the usage of such concept networks in artificial intelligence systems that are capable of utilizing concepts expressed by users to return or evaluate associated destinations.;0
444;11138781;2020;2021;INTERNATIONAL BUSINESS MACHINES CORPORATION;INTERNATIONAL BUSINESS MACHINES CORPORATION;G06T11/00,G06T13/40,G06N3/045,G06N3/08,G06T3/4053,G06T17/20,G10L13/027,G10L13/00;Creation of photorealistic 3D avatars using deep neural networks;"A computer-implemented method for the automatic generation of photorealistic 3D avatars. The method includes generating, using machine learning network, a plurality of 2D photorealistic facial images; generating, using a model agnostic meta-learner, a plurality of 2D photorealistic facial expression images based on the plurality of 2D photorealistic facial images; and generating a plurality of 3D photorealistic avatars based on the plurality of 2D photorealistic facial expression images.";5
445;11144846;2020;2021;Bank of America Corporation;Bank of America Corporation;G06N20/00,H04L41/16,H04L12/1813,H04L12/1818,H04L51/02,H04L51/04,H04L51/046,H04L51/216,H04L65/1069,G06N5/041,H04L41/5093;Complex human-computer interactions;"Methods for leveraging a plurality of machine-learning algorithms to improve a chat interaction are provided. The methods may include monitoring for initiation of a live chat session; alerting and assigning a chat responder to the live chat session; engaging one or more of a plurality of automated chat tools, the tools loaded with artificial intelligence (AI), in order to improve the response of the responder during the session; reviewing and retrieving, using the AI, from a machine learning (ML) library in electronic communication with the AI, historical information; presenting, on a chat responder screen, selected actionable information generated based on the historical information, to the responder; integrating, based on pre-determined conditions, chat responses into the ML library; and integrating into the ML library, based on the same or other pre-determined conditions, chat comments. The chat comments are generated by a chat initiator.";2
446;11146598;2020;2021;Amazon Technologies, Inc.;Amazon Technologies, Inc.;H04L65/1069,H04L51/02,H04L51/066,H04L51/18,H04L51/52;Establishing a bot-to-bot communication protocol;Systems and methods allow bots to collaborate using a bot-to-bot communication protocol. In some instances, a first bot may request to establish a bot-to-bot channel with a second bot. The first bot may be authorized to issue the request for establishing the bot-to-bot channel. To communicate with one another, the first bot may have a first application programming interface (API) that is configured to communicate over the bot-to-bot channel with the second bot in natural language Additionally, the second bot may have a second API configured to communicate over the bot-to-bot channel with the first bot in natural language. An invitation to be sent to the second bot associated with joining the bot-to-bot channel. If accepted, the first bot and the second bot may exchange messages over the bot-to-bot channel.;0
447;11152031;2021;2021;CLIPr Co.;CLIPr Co.;G11B27/031,G06F3/0482,G06F16/738,G06V20/47,G06V20/49,G11B27/005,G11B27/06,G11B27/10;System and method to compress a time frame of one or more videos;"System and method to compress multiple videos are provided. the system includes a video retrieve module configured to retrieve videos from a video library database; a video selection module configured to select videos by a user upon viewing the plurality of videos; a video clipping module configured to clip each of the multiple videos into a multiple video clips based on features with assigned importance levels, and to select one or more video clips by the user upon viewing the multiple video clips; a video summarization module configured to create a video summary, a video editing module configured to operate multiple video clips from the video summary on receiving a feedback from the user, to generate a modified video summary to compress the multiple videos. a video time calculator module configured to calculate total time eliminated; a video timer module configured to set a time frame enable the modified video summary to be played.";0
