#;patent_id;app_year;patent_year;Assignee_Org;Assignee 1;CPC;patent_title;patent_abstract;Finales Resultat
1;5660176;1993;1997;First Opinion Corporation;First Opinion Corporation;G16H50/20,G16H10/20,G16H10/60,G16H15/00,G16H20/70,G16H40/67,G16H70/20,G16H70/60,H04M3/493,A61B5/0002,A61B5/4094,G16H20/10,G16H40/63,H04M2201/40,H04M2203/355,Y10S128/92,Y10S128/925,Y10S706/924;Computerized medical diagnostic and treatment advice system;"A system and method for providing computerized, knowledge-based medical diagnostic and treatment advice. The medical advice is provided to the general public over a telephone network. Two new authoring languages, interactive voice response and speech recognition are used to enable expert and general practitioner knowledge to be encoded for access by the public. ""Meta"" functions for time-density analysis of a number of factors regarding the number of medical complaints per unit of time are an integral part of the system. A semantic discrepancy evaluator routine along with a mental status examination are used to detect the consciousness level of a user of the system. A re-enter feature monitors the user's changing condition over time. A symptom severity analysis helps to respond to the changing conditions. System sensitivity factors may be changed at a global level or other levels to adjust the system advice as necessary.";1
2;6516298;2000;2003;Sumitomo Electric Industries, Ltd.;Sumitomo Electric Industries, Ltd.;G10L13/08;System and method for synthesizing multiplexed speech and text at a receiving terminal;The reception terminal receives a code series from the communication path. The separator separates the code series into a speech code series and text information. The speech code series is decoded into a pitch period, a LSP coefficient, and code numerals by the synthesizer to reproduce the speech sound in the CELP system. Also, the text information is converted into pronunciation and accent information by the language analyzer and added to prosody information, such as phoneme time length and pitch pattern by the prosody generator. The LSP coefficient, and code numerals suitable for the phoneme are read from the segment database and the pitch frequency from the prosody information is inputted to the synthesizer and synthesized into speech sound.;1
3;6542867;2000;2003;Sumitomo Electric Industries, Ltd.;Sumitomo Electric Industries, Ltd.;G10L13/10,G10L13/08;Speech duration processing method and apparatus for Chinese text-to-speech system;"The duration of speech varies according to the characteristics of pronounced speech and pronouncing habit of the speaker. In the speech duration processing method and apparatus of this invention, a large amount of natural speech was analyzed, and the following was known: Speech duration of monosyllables will vary according to factors, such as phonemes, tones, phrase construction, locations in the phrases, locations in the sentence, and front and rear connected phonemes, etc. of the syllables. Through the use of these varying factors, a &#8220;speech duration parameter storage portion&#8221; for speech duration parameters is constructed. By retrieving the speech duration parameters and combining the same with the basic speech duration of a syllable during syllable speech duration calculation, the speech duration of each monosyllable in any sentence can be accurately decided. As recognized from experimental results, a text-to-speech system using the speech duration processing apparatus of this invention can synthesize speech with natural speech duration.";1
4;7643990;2003;2010;Apple Inc.;Apple Inc.;G10L15/187,G10L25/90;Global boundary-centric feature extraction and associated discontinuity metrics;Portions from time-domain speech segments are extracted. Feature vectors that represent the portions in a vector space are created. The feature vectors incorporate phase information of the portions. A distance between the feature vectors in the vector space is determined. In one aspect, the feature vectors are created by constructing a matrix W from the portions and decomposing the matrix W. In one aspect, decomposing the matrix W comprises extracting global boundary-centric features from the portions. In one aspect, the portions include at least one pitch period. In another aspect, the portions include centered pitch periods.;0
5;7657289;2004;2010;;;G10L13/033,G10L2021/0135;Synthesized voice production;A communications system for receiving and transmitting information signals. An electronic processor is adapted to receive information signals from at least one source, operatively connected to the electronic processor. An audible signal generator generates sounds related to the information signals. The source of information signals can be a telephone, cell phone, microphone, PDA, computer, printed document, Internet web site, e-mail or immediate message. The processor has a mechanism for generating an audible signal reminiscent of a celebrity voice, a cartoon voice, or a computer-generated sound.;6
6;7660715;2004;2010;Avaya Inc.;Avaya Inc.;G10L15/22,G10L15/065,G10L15/063;Transparent monitoring and intervention to improve automatic adaptation of speech models;A system and method to improve the automatic adaptation of one or more speech models in automatic speech recognition systems. After a dialog begins, for example, the dialog asks the customer to provide spoken input and it is recorded. If the speech recognizer determines it may not have correctly transcribed the verbal response, i.e., voice input, the invention uses monitoring and if necessary, intervention to guarantee that the next transcription of the verbal response is correct. The dialog asks the customer to repeat his verbal response, which is recorded and a transcription of the input is sent to a human monitor, i.e., agent or operator. If the transcription of the spoken input is correct, the human does not intervene and the transcription remains unmodified. If the transcription of the verbal response is incorrect, the human intervenes and the transcription of the misrecognized word is corrected. In both cases, the dialog asks the customer to confirm the unmodified and corrected transcription. If the customer confirms the unmodified or newly corrected transcription, the dialog continues and the customer does not hang up in frustration because most times only one misrecognition occurred. Finally, the invention uses the first and second customer recording of the misrecognized word or utterance along with the corrected or unmodified transcription to automatically adapt one or more speech models, which improves the performance of the speech recognition system.;1
7;7664313;2002;2010;AT&T Intellectual Property I, L.P.;AT&T Intellectual Property I, L.P.;G06V30/146,G06F40/106,G06F40/30,G06T17/00;Text-to scene conversion;The invention relates to a method of converting a set of words into a three-dimensional scene description, which may then be rendered into three-dimensional images. The invention may generate arbitrary scenes in response to a substantially unlimited range of input words. Scenes may be generated by combining objects, poses, facial expressions, environments, etc., so that they represent the input set of words. Poses may have generic elements so that referenced objects may be replaced by those mentioned in the input set of words. Likewise, a character may be dressed according to its role in the set of words. Various constraints for object positioning may be declared. The environment, including but not limited to place, time of day, and time of year, may be inferred from the input set of words.;5
8;7674966;2005;2010;;;G10H1/0025,G10H2210/026,G10H2210/151,G10H2240/085;System and method for realtime scoring of games and other applications;The invention provides a software framework that allows real-time computer-generated music to be used in interactive applications, particularly video games, by modularizing music-producing and music-modifying computer procedures into musically logical and programmatically convenient structures, as well as providing a communication mechanism between the application and the music-generating system which will allow the music to reflect the appropriate mood given the current application state.;5
9;7689416;2004;2010;;;G10L15/30,G10L15/07;System for transferring personalize matter from one computer to another;This invention combines methodologies that enhance voice recognition dictation. It describes features for moving speaker voice files eliminating redundant training of speech recognition dictation applications. It defines how to create synthetic voice models reducing speaker dependency. It combines accuracy and performance into a single measure called RAP Rate. Moreover, the invention describes enhancing voice recognition applications and systems by measure/adjusting hardware and software features for optimal voice recognition dictation incorporating methodical processes based on RAP Rate. Using these approaches and tools the invention includes a method for constructing a handheld transcriber that immediately translates audio speech into text with real-time display. The invention describes a method for applying RAP Rate and synthetic voice models to applications like voice mail to text. With the ability to move and translate voice models the invention describes new services that could be provided for a fee.;1
10;7693760;2002;2010;Oracle International Corporation;Oracle International Corporation;G06Q40/00,G06Q20/207,G06Q40/12,G06Q40/123;Method and apparatus for providing a tax service that is configurable for local jurisdictions;One embodiment of the present invention provides a system that implements a tax service that is configurable for local jurisdictions by an expert in the field, such as a tax professional, who may have little or no knowledge of computer programming. The system operates by receiving a request from a subscriber, wherein servicing the request involves calculating taxes for one or more local jurisdictions. Tax rules for a local jurisdiction can be fed into a tax rule base that is used by a tax engine that is configured to use these externally specified rules in performing tax computations. Next, the system uses the tax engine to calculate taxes for each local jurisdiction, and subsequently uses the results of the calculations in servicing the request.;0
11;7713127;2005;2010;;;A63F13/10,A63F13/47,A63F13/44,A63F13/45,A63F13/822,A63F2300/6081,A63F2300/632,A63F2300/638;Simulating dialog in electronic games;The present disclosure includes systems and techniques relating to simulating dialog in electronic games. In general, in one implementation, the technique includes: receiving a player interruption signal during presentation of a speech by a machine-controlled character in an electronic game, modifying a state of the machine-controlled character based on a time of the received player interruption relative to a length of the speech, and generating an action of the machine-controlled character based on the modified state. Modifying the state of the machine-controlled character can include adjusting an attitude variable of the machine-controlled character based on the time of the received player interruption, selecting a location in a dialog tree for the machine-controlled character based on the time of the received player interruption, or both.;2
12;7720683;2004;2010;Sensory, Incorporated;Sensory, Incorporated;G10L15/22,G10L15/285,G10L2015/0631;Method and apparatus of specifying and performing speech recognition operations;A speech recognition technique is described that has the dual benefits of not requiring collection of recordings for training while using computational resources that are cost-compatible with consumer electronic products. Methods are described for improving the recognition accuracy of a recognizer by developer interaction with a design tool that iterates the recognition data during development of a recognition set of utterances and that allows controlling and minimizing the computational resources required to implement the recognizer in hardware.;0
13;7732697;2007;2010;;;G10H1/0041,G10H1/0025,G10H2210/141,G10H2240/131;Creating music and sound that varies from playback to playback;"A method and apparatus for the creation and playback of music and/or sound; such that each time a composition is played back, a different sound sequence may be generated. In one embodiment, during composition creation, artist(s) may define how the composition may vary from playback to playback using visually interactive display(s). The artist's definition may be embedded into a composition dataset. During playback, a composition data set may be processed by a playback device and/or a playback program, so that each time the composition is played-back a unique version may be generated. Variability during playback may include: the variable selection of alternative sound segment(s); variable editing of sound segment(s) during playback processing; variable placement of sound segment(s) during playback processing; the spawning of group(s) of alternative sound segments from initiating sound segment(s); and the combining and/or mixing of alternative sound segments in one or more sound channels. MIDI-like variable compositions and the variable use of sound segments comprised of MIDI-like command sequences are also disclosed.";3
14;7742919;2005;2010;AT&T Intellectual Property I, L.P.;AT&T Intellectual Property I, L.P.;G10L13/06,G10L15/187;System and method for repairing a TTS voice database;The present invention provides various elements of a toolkit used for generating a TTS voice for use in a spoken dialog system. The embodiments in each case may be in the form of the system, a computer-readable medium, or a method for generating the TTS voice. One embodiment of the invention relates to a method of correcting a database associated with the development of a text-to-speech (TTS) voice. The method comprises generating a pronunciation dictionary for use with a TTS voice, generating a TTS voice to a stage wherein it is prepared to be tested before being deployed, identifying mislabeled phonetic units associated with the TTS voice, for each identified mislabeled phonetic unit, linking to an entry within the pronunciation dictionary to correct the entry and deleting utterances and all associated data for unacceptable utterances.;1
15;7761296;1999;2010;INTERNATIONAL BUSINESS MACHINES CORPORATION;INTERNATIONAL BUSINESS MACHINES CORPORATION;G10L15/08,G10L13/02,G10L15/10;System and method for rescoring N-best hypotheses of an automatic speech recognition system;A system and method for rescoring the N-best hypotheses from an automatic speech recognition system by comparing an original speech waveform to synthetic speech waveforms that are generated for each text sequence of the N-best hypotheses. A distance is calculated from the original speech waveform to each of the synthesized waveforms, and the text associated with the synthesized waveform that is determined to be closest to the original waveform is selected as the final hypothesis. The original waveform and each synthesized waveform are aligned to a corresponding text sequence on a phoneme level. The mean of the feature vectors which align to each phoneme is computed for the original waveform as well as for each of the synthesized hypotheses. The distance of a synthesized hypothesis to the original speech signal is then computed as the sum over all phonemes in the hypothesis of the Euclidean distance between the means of the feature vectors of the frames aligning to that phoneme for the original and the synthesized signals. The text of the hypothesis which is closest under the above metric to the original waveform is chosen as the final system output.;1
16;7788262;2007;2010;;;G06F16/36;Method and system for creating context based summary;A method and system for generating electronic data summary based on context and semantics of the document and its subsequent usage is disclosed. The method and system provides for generating a taxonomy of concepts, assigning unique-identifiers and weights to the taxonomy concepts using a given corpus of electronic data, using the taxonomy to identify the semantics of the document to be summarized, selecting text from a given document based on the weights of unique-identifiers in the taxonomy, generation of a list of semantic-structures and pruning of the list based upon an entropy threshold, generation of summary from the list of semantic-structures, generation of a topic summary from a given list of similar summaries, publishing of the summary in a known format, and usage of the summary to prevent denial of information.;2
17;7835910;2003;2010;AT&T Intellectual Property I, L.P.;AT&T Intellectual Property I, L.P.;G10L15/063,G10L2015/0635,G10L2015/0636;Exploiting unlabeled utterances for spoken language understanding;A system and method for exploiting unlabeled utterances in the augmentation of a classifier model is disclosed. In one embodiment, a classifier is initially trained using a labeled set of utterances. Another set of utterances is then selected from an available set of unlabeled utterances. In one embodiment, this selection process can be based on a confidence score threshold. The trained classifier is then augmented using the selected set of unlabeled utterances.;0
18;7890374;2000;2011;Rovi Technologies Corporation;Rovi Technologies Corporation;G06Q30/02,G06Q30/06,G06Q30/0633;System and method for presenting music to consumers;The present invention provides a computer-implemented method and system for providing user requested music. The method comprises of receiving user input that defines a plurality of music search parameters. Some of the music search parameters may describe music content attributes. Thereafter, the process searches for music samples based upon the user provided search parameters. The process then presents music samples to the user.The method also determines if the user wants to buy any of the presented music samples, a set of music samples similar to the music purchased and/or a set of music samples different than the music bought.;0
19;7902447;2006;2011;SONY COMPUTER ENTERTAINMENT INC.;SONY COMPUTER ENTERTAINMENT INC.;G10H1/0025;Automatic composition of sound sequences using finite state automata;In one embodiment, a method for the automatic composition of music is disclosed. The method begins by receiving a plurality of input sound sequences containing sound frequencies with corresponding time duration. The method continues with converting the plurality of input sound sequences to a finite state automaton using a system that allows over-generation, followed by receiving exploration rules that constrain how the finite state automaton is to be traversed. The next step is creating a path marker data structure indexing a plurality of path markers, where each path marker contains a path marker history and a path marker registry. After the path marker data structure is created, the method continues by traversing the finite state automaton with a graph exploration procedure that uses the exploration rules and the plurality of path markers to determine paths across the finite state automaton. During the exploration the path marker history and the path marker registry of particular path markers are updated when traversing the finite state automaton. As the finite state automaton is traversed the method includes storing the paths across the finite state automaton to the path marker data structure to define recorded path markers, wherein the recorded path markers that are not found in the plurality of input sound sequences define new music compositions.;3
20;7912718;2006;2011;AT&T Intellectual Property I, L.P.;AT&T Intellectual Property I, L.P.;G10L13/06;Method and system for enhancing a speech database;A system, method and computer readable medium that enhances a speech database for speech synthesis is disclosed. The method may include labeling audio files in a primary speech database and a secondary speech database, enhancing the primary speech database by placing the labeled audio files from the secondary speech database into the primary speech database, and storing the enhanced primary speech database for use in speech synthesis.;0
21;7925496;2007;2011;The United States of America as represented by the Secretary of the Navy;The United States of America as represented by the Secretary of the Navy;G06F16/345;Method for summarizing natural language text;A method includes the steps of comparing a first body of text with a user-created summary of the first body of text, creating rules based on the comparison of the first body of text with the user-created summary of the first body of text, selecting one or more summary rules for generating a computer-created summary of a second body of text, and applying the selected summary rules to the second body of text to generate a computer-created summary of the second body of text. The first body of text may be a user-corrected summary of a computer-created summary of the first body of text. The rules may be selected based on previous use, frequency of use, context of the body of text, or most-specific applicability. The rules may be iteratively applied to generate a summary. A method is also provided for generating a heading for a summary of text.;2
22;7945952;2005;2011;GOOGLE LLC;GOOGLE LLC;H04L63/08,G06F21/316,G06F2221/2103,G06F2221/2105;Methods and apparatuses for presenting challenges to tell humans and computers apart;Methods and apparatuses to tell humans and machines apart. In one embodiment, automated determination of whether a human or machine is at the other end of a communication channel is based on whether the correct response to a challenge/question is received from the other end of the communication channel. The challenge is provided in a non-image format, such as a text based questions or a sound clip, to prevent abuses of the communication system by computer software robots. The communication system may be primarily for text and/or voice communications, or be such that the rendering image-based challenges can cause significant disruption in normal flow of usage. In one example, the challenge includes deliberately generated random misspelling. In one example, the challenge is context sensitive, factual based, and/or instructive of an operation in a natural language to obtain a result.;0
23;7962530;2008;2011;;;G06F16/68,G06F16/40,G06F16/634,G06F16/683;Method for locating information in a musical database using a fragment of a melody;A system and method for retrieving musical information from a database based on a melody fragment. The system may be used by a person without formal musical training to retrieve musical data (e.g., the name of a song, bibliographic information about a song, or the song itself) from a database by providing the melody or fragment of the melody of the desired music to a computer interface. The melody may be provided by singing, humming, whistling, or playing a musical instrument, for example, a keyboard. The inputted melodic information is encoded using relative changes in pitch and rhythm throughout the melody. The encoded information is then compared using a matching algorithm to similarly encoded melodic information representative of many musical pieces (e.g., songs). Results may also be sorted using a weighted algorithm.;1
24;8032383;2007;2011;FoneWeb, Inc.;FoneWeb, Inc.;G10L15/30,G10L2015/223,G10L2015/228;Speech controlled services and devices using internet;A speech service, including a speech-to-text engine and a text-to-speech engine, creates and maintains user profiles at a central location accessible over the Internet. A user connects to a software application over a mobile telephone and delivers a voice command. The speech service transcribes the voice command into a text command for the software application. The software application performs a service desired by the user and delivers a text result to the speech service that is converted into a speech result that is delivered to the user. A user speaks to a hardware device to perform a function. The hardware device sends the speech to the speech service over the Internet that transcribes the speech into a text command that is sent over the Internet to a device service provider. The device service provider maps the text command into a device command that is then sent back over the Internet to the hardware device to perform the function. A remote hardware device can be controlled using the software application.;1
25;8041565;2007;2011;FoneWeb, Inc.;FoneWeb, Inc.;G10L15/28;Precision speech to text conversion;"A speech-to-text conversion module uses a central database of user speech profiles to convert speech to text. Incoming audio information is fragmented into numerous audio fragments based upon detecting silence. The audio information is also converted to numerous text files by any number of speech engines. Each text file is then fragmented into numerous text fragments based upon the boundaries established during the audio fragmentation. Each set of text fragments from the different speech engines corresponding to a single audio fragments is then compared. The best approximation of the audio fragment is produced from the set of text fragments; a hybrid may be produced. If no agreement is reached, the audio fragment and set the text fragments are sent to human agents who verify and edit to produce a final edited text fragment that best corresponds to the audio fragment. Fragmentation that produces overlapping audio fragments requires splicing of the final text fragments to produce the output text file.";1
